depender,recent_downloads,total_downloads,dependency_kind,optional,url,description
testcontainers,2024561,6448855,normal,False,https://crates.io/crates/testcontainers,A library for integration-testing against docker containers from within Rust.
binstalk-downloader,50752,315584,normal,False,https://crates.io/crates/binstalk-downloader,The binstall toolkit for downloading and extracting file
liboxen,29456,183841,normal,False,https://crates.io/crates/liboxen,"Oxen is a fast, unstructured data version control, to help version datasets, written in Rust."
opa-wasm,12569,47132,normal,True,https://crates.io/crates/opa-wasm,A crate to use OPA policies compiled to WASM.
provider-archive,11813,190941,normal,False,https://crates.io/crates/provider-archive,Library for reading and writing wasmCloud capability provider archive files
async-tftp,11377,94875,dev,False,https://crates.io/crates/async-tftp,Executor agnostic async TFTP implementation
wash-cli,10212,133509,normal,False,https://crates.io/crates/wash-cli,wasmCloud Shell (wash) CLI tool
graph_builder,10200,51938,dev,False,https://crates.io/crates/graph_builder,A building block for high-performant graph algorithms.
hop-cli,9740,88513,normal,False,https://crates.io/crates/hop-cli,Interact with Hop in your terminal
swiftide-docker-executor,8283,23449,normal,False,https://crates.io/crates/swiftide-docker-executor,A docker executor for swiftide agent tools
pesde,7793,40352,normal,False,https://crates.io/crates/pesde,"A package manager for the Luau programming language, supporting multiple runtimes including Roblox and Lune"
wash-lib,6789,72842,normal,False,https://crates.io/crates/wash-lib,wasmCloud Shell (wash) libraries
bndl,6199,50015,normal,False,https://crates.io/crates/bndl,Bundle build artifacts into a redistributable archive.
grafbase-local-backend,5508,50242,normal,False,https://crates.io/crates/grafbase-local-backend,The local backend for grafbase developer tools
static-web-server,5135,37969,normal,True,https://crates.io/crates/static-web-server,"A cross-platform, high-performance and asynchronous web server for static files-serving."
antimatter,4691,36678,normal,True,https://crates.io/crates/antimatter,antimatter.io Rust library for data control
ripgrep_all,4609,39180,normal,False,https://crates.io/crates/ripgrep_all,"rga: ripgrep, but also search in PDFs, E-Books, Office documents, zip, tar.gz, etc."
wit-deps,3549,17511,normal,False,https://crates.io/crates/wit-deps,WIT dependency management
libprotonup,2983,19836,normal,False,https://crates.io/crates/libprotonup,Library for Custom Proton Download and installation
krata-oci,2811,21829,normal,False,https://crates.io/crates/krata-oci,OCI services for the krata isolation engine
bacup,2788,17217,normal,False,https://crates.io/crates/bacup,An easy-to-use backup tool designed for servers.
bindle,2596,39355,normal,True,https://crates.io/crates/bindle,An aggregate object storage system for applications
krata-daemon,2464,19198,normal,False,https://crates.io/crates/krata-daemon,Daemon for the krata isolation engine
maelstrom-container,2382,17024,normal,False,https://crates.io/crates/maelstrom-container,Library for downloading and storing OCI container images.
debian-packaging,2365,17411,normal,False,https://crates.io/crates/debian-packaging,Debian packaging primitives
flop,2129,21307,normal,False,https://crates.io/crates/flop,floppy-disk facades for common archive formats!
libpkgx,2001,7061,normal,False,https://crates.io/crates/libpkgx,Install and run `pkgx` packages
maia-httpd,1940,14424,normal,False,https://crates.io/crates/maia-httpd,Maia SDR HTTP server
cargo-gha,1894,16382,normal,False,https://crates.io/crates/cargo-gha,"Version lock, cache, and run binaries from any Github Release assets. Pull in external tools and keep the versions in sync across your team, and forget installing globally."
wash,1644,4172,normal,False,https://crates.io/crates/wash,wasmCloud Shell (wash) - CLI tool and library for wasmCloud development
maelstrom-layer-fs,1463,10178,normal,False,https://crates.io/crates/maelstrom-layer-fs,FUSE filesystem for use with Maelstrom.
blindspot,1390,13038,normal,False,https://crates.io/crates/blindspot,Install and update single binary apps without any hassle
netmito,1315,3052,normal,False,https://crates.io/crates/netmito,A Unified Distributed Transport Evaluation Framework
async-ffmpeg-sidecar,1293,1996,normal,True,https://crates.io/crates/async-ffmpeg-sidecar,Wrap a standalone FFmpeg binary in an intiutive Stream interface.
read-url,1189,2992,normal,True,https://crates.io/crates/read-url,Read from a wide variety of URL types
switchboard-container-utils,1169,10405,normal,False,https://crates.io/crates/switchboard-container-utils,Rust library to interact and manage containers.
data-source,973,3768,normal,True,https://crates.io/crates/data-source,a simple crate that fetches data from different sources
direct-share,972,8570,normal,False,https://crates.io/crates/direct-share,Share any files easily from your machine
kaledis,929,3477,normal,False,https://crates.io/crates/kaledis,"A new way to LÖVE. Kaledis is a tool for allowing Luau to be used with Love2D via transpiling, alongside providing easier & simpler management of Love2D projects."
depit,766,6461,normal,False,https://crates.io/crates/depit,WIT dependency management
pierport,646,8413,normal,False,https://crates.io/crates/pierport,Urbit pier import protocol implementation
async_bagit,384,2230,dev,False,https://crates.io/crates/async_bagit,Create and load BagIt containers
unarchive,343,833,normal,False,https://crates.io/crates/unarchive,A crate to unarchive common archive formats
sb-func-tools,290,2447,normal,False,https://crates.io/crates/sb-func-tools,A Rust CLI to help manage and debug your Switchboard Functions.
turntable,283,2297,normal,False,https://crates.io/crates/turntable,Turntable is unpkg copy
rustfs-zip,277,277,normal,False,https://crates.io/crates/rustfs-zip,"ZIP file handling for RustFS, providing support for reading and writing ZIP archives."
archlinux-userland-fs-cmp,220,1517,normal,False,https://crates.io/crates/archlinux-userland-fs-cmp,Forensic tool to read all installed packages from a mounted Arch Linux drive and compare the filesystem to a trusted source
apple-opensource-downloader,213,1710,normal,False,https://crates.io/crates/apple-opensource-downloader,Easily download Apple's open source code from opensource.apple.com (AOS)
adoptium_api,208,208,dev,False,https://crates.io/crates/adoptium_api,Typed wrapper for a Adoptium REST API
nicky,183,877,normal,False,https://crates.io/crates/nicky,configuration management for developers
gi-get-artifact,176,1412,normal,False,https://crates.io/crates/gi-get-artifact,Downloads Gitlab artifacts
gitarena,170,1454,normal,False,https://crates.io/crates/gitarena,"Software development platform with built-in vcs, issue tracking and code review"
kache,170,1433,normal,False,https://crates.io/crates/kache,Store and retrieve the Rust build cache.
